product_id,category,sub_category,product_name,product_keyword,cat_key,subcat_key,bag,bow
OFF-AP-10003860,Office Supplies,Appliances,Fellowes Advanced 8 Outlet Surge Suppressor with Phone/Fax Protection,"['fellowes', 'advanced', '8', 'outlet', 'surge', 'suppressor', 'phone', 'fax', 'protection']",['officesupplies'],['appliances'],"['officesupplies', 'appliances', 'fellowes', 'advanced', '8', 'outlet', 'surge', 'suppressor', 'phone', 'fax', 'protection']",officesupplies appliances fellowes advanced 8 outlet surge suppressor phone fax protection
FUR-FU-10003832,Furniture,Furnishings,"Eldon Expressions Punched Metal & Wood Desk Accessories, Black & Cherry","['eldon', 'expressions', 'punched', 'metal', 'wood', 'desk', 'accessories', 'black', 'cherry']",['furniture'],['furnishings'],"['furniture', 'furnishings', 'eldon', 'expressions', 'punched', 'metal', 'wood', 'desk', 'accessories', 'black', 'cherry']",furniture furnishings eldon expressions punched metal wood desk accessories black cherry
OFF-BI-10002393,Office Supplies,Binders,Binder Posts,"['binder', 'posts']",['officesupplies'],['binders'],"['officesupplies', 'binders', 'binder', 'posts']",officesupplies binders binder posts
OFF-PA-10001204,Office Supplies,Paper,Xerox 1972,"['xerox', '1972']",['officesupplies'],['paper'],"['officesupplies', 'paper', 'xerox', '1972']",officesupplies paper xerox 1972
OFF-ST-10002444,Office Supplies,Storage,Recycled Eldon Regeneration Jumbo File,"['recycled', 'eldon', 'regeneration', 'jumbo', 'file']",['officesupplies'],['storage'],"['officesupplies', 'storage', 'recycled', 'eldon', 'regeneration', 'jumbo', 'file']",officesupplies storage recycled eldon regeneration jumbo file
OFF-ST-10003816,Office Supplies,Storage,Fellowes High-Stak Drawer Files,"['fellowes', 'high', 'stak', 'drawer', 'files']",['officesupplies'],['storage'],"['officesupplies', 'storage', 'fellowes', 'high', 'stak', 'drawer', 'files']",officesupplies storage fellowes high stak drawer files
OFF-BI-10000014,Office Supplies,Binders,Heavy-Duty E-Z-D Binders,"['heavy', 'duty', 'e', 'z', 'binders']",['officesupplies'],['binders'],"['officesupplies', 'binders', 'heavy', 'duty', 'e', 'z', 'binders']",officesupplies binders heavy duty e z binders
OFF-PA-10002659,Office Supplies,Paper,Avoid Verbal Orders Carbonless Minifold Book,"['avoid', 'verbal', 'orders', 'carbonless', 'minifold', 'book']",['officesupplies'],['paper'],"['officesupplies', 'paper', 'avoid', 'verbal', 'orders', 'carbonless', 'minifold', 'book']",officesupplies paper avoid verbal orders carbonless minifold book
OFF-PA-10001801,Office Supplies,Paper,Xerox 193,"['xerox', '193']",['officesupplies'],['paper'],"['officesupplies', 'paper', 'xerox', '193']",officesupplies paper xerox 193
OFF-ST-10003306,Office Supplies,Storage,Letter Size Cart,"['letter', 'size', 'cart']",['officesupplies'],['storage'],"['officesupplies', 'storage', 'letter', 'size', 'cart']",officesupplies storage letter size cart
TEC-PH-10004434,Technology,Phones,Cisco IP Phone 7961G VoIP phone - Dark gray,"['cisco', 'ip', 'phone', '7961g', 'voip', 'dark', 'gray']",['technology'],['phones'],"['technology', 'phones', 'cisco', 'ip', 'phone', '7961g', 'voip', 'dark', 'gray']",technology phones cisco ip phone 7961g voip dark gray
FUR-CH-10000749,Furniture,Chairs,Office Star - Ergonomic Mid Back Chair with 2-Way Adjustable Arms,"['office', 'star', 'ergonomic', 'mid', 'back', 'chair', '2', 'way', 'adjustable', 'arms']",['furniture'],['chairs'],"['furniture', 'chairs', 'office', 'star', 'ergonomic', 'mid', 'back', 'chair', '2', 'way', 'adjustable', 'arms']",furniture chairs office star ergonomic mid back chair 2 way adjustable arms
OFF-PA-10003591,Office Supplies,Paper,Southworth 100% Cotton The Best Paper,"['southworth', '100', 'cotton', 'best', 'paper']",['officesupplies'],['paper'],"['officesupplies', 'paper', 'southworth', '100', 'cotton', 'best', 'paper']",officesupplies paper southworth 100 cotton best paper
TEC-PH-10002660,Technology,Phones,Nortel Networks T7316 E Nt8 B27,"['nortel', 'networks', 't7316', 'e', 'nt8', 'b27']",['technology'],['phones'],"['technology', 'phones', 'nortel', 'networks', 't7316', 'e', 'nt8', 'b27']",technology phones nortel networks t7316 e nt8 b27
OFF-AR-10001315,Office Supplies,Art,Newell 310,"['newell', '310']",['officesupplies'],['art'],"['officesupplies', 'art', 'newell', '310']",officesupplies art newell 310
OFF-BI-10000546,Office Supplies,Binders,Avery Durable Binders,"['avery', 'durable', 'binders']",['officesupplies'],['binders'],"['officesupplies', 'binders', 'avery', 'durable', 'binders']",officesupplies binders avery durable binders
FUR-FU-10000576,Furniture,Furnishings,Luxo Professional Fluorescent Magnifier Lamp with Clamp-Mount Base,"['luxo', 'professional', 'fluorescent', 'magnifier', 'lamp', 'clamp', 'mount', 'base']",['furniture'],['furnishings'],"['furniture', 'furnishings', 'luxo', 'professional', 'fluorescent', 'magnifier', 'lamp', 'clamp', 'mount', 'base']",furniture furnishings luxo professional fluorescent magnifier lamp clamp mount base
OFF-SU-10002522,Office Supplies,Supplies,Acme Kleen Earth Office Shears,"['acme', 'kleen', 'earth', 'office', 'shears']",['officesupplies'],['supplies'],"['officesupplies', 'supplies', 'acme', 'kleen', 'earth', 'office', 'shears']",officesupplies supplies acme kleen earth office shears
TEC-PH-10003655,Technology,Phones,Sannysis Cute Owl Design Soft Skin Case Cover for Samsung Galaxy S4,"['sannysis', 'cute', 'owl', 'design', 'soft', 'skin', 'case', 'cover', 'samsung', 'galaxy', 's4']",['technology'],['phones'],"['technology', 'phones', 'sannysis', 'cute', 'owl', 'design', 'soft', 'skin', 'case', 'cover', 'samsung', 'galaxy', 's4']",technology phones sannysis cute owl design soft skin case cover samsung galaxy s4
OFF-ST-10001291,Office Supplies,Storage,"Tenex Personal Self-Stacking Standard File Box, Black/Gray","['tenex', 'personal', 'self', 'stacking', 'standard', 'file', 'box', 'black', 'gray']",['officesupplies'],['storage'],"['officesupplies', 'storage', 'tenex', 'personal', 'self', 'stacking', 'standard', 'file', 'box', 'black', 'gray']",officesupplies storage tenex personal self stacking standard file box black gray
OFF-AR-10003752,Office Supplies,Art,Deluxe Chalkboard Eraser Cleaner,"['deluxe', 'chalkboard', 'eraser', 'cleaner']",['officesupplies'],['art'],"['officesupplies', 'art', 'deluxe', 'chalkboard', 'eraser', 'cleaner']",officesupplies art deluxe chalkboard eraser cleaner
OFF-PA-10000130,Office Supplies,Paper,Xerox 199,"['xerox', '199']",['officesupplies'],['paper'],"['officesupplies', 'paper', 'xerox', '199']",officesupplies paper xerox 199
OFF-AP-10002518,Office Supplies,Appliances,Kensington 7 Outlet MasterPiece Power Center,"['kensington', '7', 'outlet', 'masterpiece', 'power', 'center']",['officesupplies'],['appliances'],"['officesupplies', 'appliances', 'kensington', '7', 'outlet', 'masterpiece', 'power', 'center']",officesupplies appliances kensington 7 outlet masterpiece power center
OFF-PA-10003302,Office Supplies,Paper,Xerox 1906,"['xerox', '1906']",['officesupplies'],['paper'],"['officesupplies', 'paper', 'xerox', '1906']",officesupplies paper xerox 1906
OFF-BI-10004099,Office Supplies,Binders,GBC VeloBinder Strips,"['gbc', 'velobinder', 'strips']",['officesupplies'],['binders'],"['officesupplies', 'binders', 'gbc', 'velobinder', 'strips']",officesupplies binders gbc velobinder strips
OFF-BI-10004716,Office Supplies,Binders,Wilson Jones Hanging Recycled Pressboard Data Binders,"['wilson', 'jones', 'hanging', 'recycled', 'pressboard', 'data', 'binders']",['officesupplies'],['binders'],"['officesupplies', 'binders', 'wilson', 'jones', 'hanging', 'recycled', 'pressboard', 'data', 'binders']",officesupplies binders wilson jones hanging recycled pressboard data binders
TEC-MA-10002210,Technology,Machines,Epson TM-T88V Direct Thermal Printer - Monochrome - Desktop,"['epson', 'tm', 't88v', 'direct', 'thermal', 'printer', 'monochrome', 'desktop']",['technology'],['machines'],"['technology', 'machines', 'epson', 'tm', 't88v', 'direct', 'thermal', 'printer', 'monochrome', 'desktop']",technology machines epson tm t88v direct thermal printer monochrome desktop
OFF-BI-10000285,Office Supplies,Binders,XtraLife ClearVue Slant-D Ring Binders by Cardinal,"['xtralife', 'clearvue', 'slant', 'ring', 'binders', 'cardinal']",['officesupplies'],['binders'],"['officesupplies', 'binders', 'xtralife', 'clearvue', 'slant', 'ring', 'binders', 'cardinal']",officesupplies binders xtralife clearvue slant ring binders cardinal
OFF-PA-10001804,Office Supplies,Paper,Xerox 195,"['xerox', '195']",['officesupplies'],['paper'],"['officesupplies', 'paper', 'xerox', '195']",officesupplies paper xerox 195
FUR-FU-10002506,Furniture,Furnishings,"Tensor ""Hersey Kiss"" Styled Floor Lamp","['tensor', 'hersey', 'kiss', 'styled', 'floor', 'lamp']",['furniture'],['furnishings'],"['furniture', 'furnishings', 'tensor', 'hersey', 'kiss', 'styled', 'floor', 'lamp']",furniture furnishings tensor hersey kiss styled floor lamp
FUR-FU-10002253,Furniture,Furnishings,"Howard Miller 13"" Diameter Pewter Finish Round Wall Clock","['howard', 'miller', '13', 'diameter', 'pewter', 'finish', 'round', 'wall', 'clock']",['furniture'],['furnishings'],"['furniture', 'furnishings', 'howard', 'miller', '13', 'diameter', 'pewter', 'finish', 'round', 'wall', 'clock']",furniture furnishings howard miller 13 diameter pewter finish round wall clock
OFF-BI-10000494,Office Supplies,Binders,Acco Economy Flexible Poly Round Ring Binder,"['acco', 'economy', 'flexible', 'poly', 'round', 'ring', 'binder']",['officesupplies'],['binders'],"['officesupplies', 'binders', 'acco', 'economy', 'flexible', 'poly', 'round', 'ring', 'binder']",officesupplies binders acco economy flexible poly round ring binder
TEC-PH-10003215,Technology,Phones,Jackery Bar Premium Fast-charging Portable Charger,"['jackery', 'bar', 'premium', 'fast', 'charging', 'portable', 'charger']",['technology'],['phones'],"['technology', 'phones', 'jackery', 'bar', 'premium', 'fast', 'charging', 'portable', 'charger']",technology phones jackery bar premium fast charging portable charger
TEC-AC-10001998,Technology,Accessories,Logitech LS21 Speaker System - PC Multimedia - 2.1-CH - Wired,"['logitech', 'ls21', 'speaker', 'system', 'pc', 'multimedia', '2', '1', 'ch', 'wired']",['technology'],['accessories'],"['technology', 'accessories', 'logitech', 'ls21', 'speaker', 'system', 'pc', 'multimedia', '2', '1', 'ch', 'wired']",technology accessories logitech ls21 speaker system pc multimedia 2 1 ch wired
OFF-AR-10003696,Office Supplies,Art,Panasonic KP-350BK Electric Pencil Sharpener with Auto Stop,"['panasonic', 'kp', '350bk', 'electric', 'pencil', 'sharpener', 'auto', 'stop']",['officesupplies'],['art'],"['officesupplies', 'art', 'panasonic', 'kp', '350bk', 'electric', 'pencil', 'sharpener', 'auto', 'stop']",officesupplies art panasonic kp 350bk electric pencil sharpener auto stop
FUR-CH-10000665,Furniture,Chairs,"Global Airflow Leather Mesh Back Chair, Black","['global', 'airflow', 'leather', 'mesh', 'back', 'chair', 'black']",['furniture'],['chairs'],"['furniture', 'chairs', 'global', 'airflow', 'leather', 'mesh', 'back', 'chair', 'black']",furniture chairs global airflow leather mesh back chair black
OFF-PA-10000520,Office Supplies,Paper,Xerox 201,"['xerox', '201']",['officesupplies'],['paper'],"['officesupplies', 'paper', 'xerox', '201']",officesupplies paper xerox 201
FUR-FU-10003664,Furniture,Furnishings,"Electrix Architect's Clamp-On Swing Arm Lamp, Black","['electrix', 'architect', 'clamp', 'swing', 'arm', 'lamp', 'black']",['furniture'],['furnishings'],"['furniture', 'furnishings', 'electrix', 'architect', 'clamp', 'swing', 'arm', 'lamp', 'black']",furniture furnishings electrix architect clamp swing arm lamp black
OFF-SU-10002557,Office Supplies,Supplies,Fiskars Spring-Action Scissors,"['fiskars', 'spring', 'action', 'scissors']",['officesupplies'],['supplies'],"['officesupplies', 'supplies', 'fiskars', 'spring', 'action', 'scissors']",officesupplies supplies fiskars spring action scissors
TEC-AC-10003095,Technology,Accessories,Logitech G35 7.1-Channel Surround Sound Headset,"['logitech', 'g35', '7', '1', 'channel', 'surround', 'sound', 'headset']",['technology'],['accessories'],"['technology', 'accessories', 'logitech', 'g35', '7', '1', 'channel', 'surround', 'sound', 'headset']",technology accessories logitech g35 7 1 channel surround sound headset
FUR-TA-10002622,Furniture,Tables,"Bush Andora Conference Table, Maple/Graphite Gray Finish","['bush', 'andora', 'conference', 'table', 'maple', 'graphite', 'gray', 'finish']",['furniture'],['tables'],"['furniture', 'tables', 'bush', 'andora', 'conference', 'table', 'maple', 'graphite', 'gray', 'finish']",furniture tables bush andora conference table maple graphite gray finish
OFF-AR-10001915,Office Supplies,Art,Peel-Off China Markers,"['peel', 'china', 'markers']",['officesupplies'],['art'],"['officesupplies', 'art', 'peel', 'china', 'markers']",officesupplies art peel china markers
TEC-PH-10001809,Technology,Phones,Panasonic KX T7736-B Digital phone,"['panasonic', 'kx', 't7736', 'b', 'digital', 'phone']",['technology'],['phones'],"['technology', 'phones', 'panasonic', 'kx', 't7736', 'b', 'digital', 'phone']",technology phones panasonic kx t7736 b digital phone
OFF-PA-10001892,Office Supplies,Paper,"Rediform Wirebound ""Phone Memo"" Message Book, 11 x 5-3/4","['rediform', 'wirebound', 'phone', 'memo', 'message', 'book', '11', 'x', '5', '3', '4']",['officesupplies'],['paper'],"['officesupplies', 'paper', 'rediform', 'wirebound', 'phone', 'memo', 'message', 'book', '11', 'x', '5', '3', '4']",officesupplies paper rediform wirebound phone memo message book 11 x 5 3 4
FUR-CH-10004983,Furniture,Chairs,Office Star - Mid Back Dual function Ergonomic High Back Chair with 2-Way Adjustable Arms,"['office', 'star', 'mid', 'back', 'dual', 'function', 'ergonomic', 'high', 'chair', '2', 'way', 'adjustable', 'arms']",['furniture'],['chairs'],"['furniture', 'chairs', 'office', 'star', 'mid', 'back', 'dual', 'function', 'ergonomic', 'high', 'chair', '2', 'way', 'adjustable', 'arms']",furniture chairs office star mid back dual function ergonomic high chair 2 way adjustable arms
OFF-ST-10000036,Office Supplies,Storage,"Recycled Data-Pak for Archival Bound Computer Printouts, 12-1/2 x 12-1/2 x 16","['recycled', 'data', 'pak', 'archival', 'bound', 'computer', 'printouts', '12', '1', '2', 'x', '16']",['officesupplies'],['storage'],"['officesupplies', 'storage', 'recycled', 'data', 'pak', 'archival', 'bound', 'computer', 'printouts', '12', '1', '2', 'x', '16']",officesupplies storage recycled data pak archival bound computer printouts 12 1 2 x 16
FUR-CH-10002126,Furniture,Chairs,Hon Deluxe Fabric Upholstered Stacking Chairs,"['hon', 'deluxe', 'fabric', 'upholstered', 'stacking', 'chairs']",['furniture'],['chairs'],"['furniture', 'chairs', 'hon', 'deluxe', 'fabric', 'upholstered', 'stacking', 'chairs']",furniture chairs hon deluxe fabric upholstered stacking chairs
OFF-PA-10004609,Office Supplies,Paper,Xerox 221,"['xerox', '221']",['officesupplies'],['paper'],"['officesupplies', 'paper', 'xerox', '221']",officesupplies paper xerox 221
OFF-ST-10001496,Office Supplies,Storage,Standard Rollaway File with Lock,"['standard', 'rollaway', 'file', 'lock']",['officesupplies'],['storage'],"['officesupplies', 'storage', 'standard', 'rollaway', 'file', 'lock']",officesupplies storage standard rollaway file lock
TEC-AC-10001383,Technology,Accessories,Logitech Wireless Touch Keyboard K400,"['logitech', 'wireless', 'touch', 'keyboard', 'k400']",['technology'],['accessories'],"['technology', 'accessories', 'logitech', 'wireless', 'touch', 'keyboard', 'k400']",technology accessories logitech wireless touch keyboard k400
FUR-FU-10004671,Furniture,Furnishings,"Executive Impressions 12"" Wall Clock","['executive', 'impressions', '12', 'wall', 'clock']",['furniture'],['furnishings'],"['furniture', 'furnishings', 'executive', 'impressions', '12', 'wall', 'clock']",furniture furnishings executive impressions 12 wall clock
OFF-AP-10003040,Office Supplies,Appliances,Fellowes 8 Outlet Superior Workstation Surge Protector w/o Phone/Fax/Modem Protection,"['fellowes', '8', 'outlet', 'superior', 'workstation', 'surge', 'protector', 'w', 'phone', 'fax', 'modem', 'protection']",['officesupplies'],['appliances'],"['officesupplies', 'appliances', 'fellowes', '8', 'outlet', 'superior', 'workstation', 'surge', 'protector', 'w', 'phone', 'fax', 'modem', 'protection']",officesupplies appliances fellowes 8 outlet superior workstation surge protector w phone fax modem protection
TEC-CO-10001943,Technology,Copiers,Canon PC-428 Personal Copier,"['canon', 'pc', '428', 'personal', 'copier']",['technology'],['copiers'],"['technology', 'copiers', 'canon', 'pc', '428', 'personal', 'copier']",technology copiers canon pc 428 personal copier
OFF-FA-10004854,Office Supplies,Fasteners,"Vinyl Coated Wire Paper Clips in Organizer Box, 800/Box","['vinyl', 'coated', 'wire', 'paper', 'clips', 'organizer', 'box', '800']",['officesupplies'],['fasteners'],"['officesupplies', 'fasteners', 'vinyl', 'coated', 'wire', 'paper', 'clips', 'organizer', 'box', '800']",officesupplies fasteners vinyl coated wire paper clips organizer box 800
FUR-FU-10001095,Furniture,Furnishings,DAX Black Cherry Wood-Tone Poster Frame,"['dax', 'black', 'cherry', 'wood', 'tone', 'poster', 'frame']",['furniture'],['furnishings'],"['furniture', 'furnishings', 'dax', 'black', 'cherry', 'wood', 'tone', 'poster', 'frame']",furniture furnishings dax black cherry wood tone poster frame
OFF-PA-10000061,Office Supplies,Paper,Xerox 205,"['xerox', '205']",['officesupplies'],['paper'],"['officesupplies', 'paper', 'xerox', '205']",officesupplies paper xerox 205
FUR-CH-10003535,Furniture,Chairs,"Global Armless Task Chair, Royal Blue","['global', 'armless', 'task', 'chair', 'royal', 'blue']",['furniture'],['chairs'],"['furniture', 'chairs', 'global', 'armless', 'task', 'chair', 'royal', 'blue']",furniture chairs global armless task chair royal blue
OFF-BI-10004182,Office Supplies,Binders,Economy Binders,"['economy', 'binders']",['officesupplies'],['binders'],"['officesupplies', 'binders', 'economy', 'binders']",officesupplies binders economy binders
TEC-PH-10002922,Technology,Phones,ShoreTel ShorePhone IP 230 VoIP phone,"['shoretel', 'shorephone', 'ip', '230', 'voip', 'phone']",['technology'],['phones'],"['technology', 'phones', 'shoretel', 'shorephone', 'ip', '230', 'voip', 'phone']",technology phones shoretel shorephone ip 230 voip phone
OFF-PA-10004156,Office Supplies,Paper,Xerox 188,"['xerox', '188']",['officesupplies'],['paper'],"['officesupplies', 'paper', 'xerox', '188']",officesupplies paper xerox 188
TEC-PH-10001557,Technology,Phones,Pyle PMP37LED,"['pyle', 'pmp37led']",['technology'],['phones'],"['technology', 'phones', 'pyle', 'pmp37led']",technology phones pyle pmp37led
OFF-BI-10004209,Office Supplies,Binders,"Fellowes Twister Kit, Gray/Clear, 3/pkg","['fellowes', 'twister', 'kit', 'gray', 'clear', '3', 'pkg']",['officesupplies'],['binders'],"['officesupplies', 'binders', 'fellowes', 'twister', 'kit', 'gray', 'clear', '3', 'pkg']",officesupplies binders fellowes twister kit gray clear 3 pkg
FUR-FU-10004460,Furniture,Furnishings,"Howard Miller 12"" Round Wall Clock","['howard', 'miller', '12', 'round', 'wall', 'clock']",['furniture'],['furnishings'],"['furniture', 'furnishings', 'howard', 'miller', '12', 'round', 'wall', 'clock']",furniture furnishings howard miller 12 round wall clock
FUR-TA-10003392,Furniture,Tables,Global Adaptabilities Conference Tables,"['global', 'adaptabilities', 'conference', 'tables']",['furniture'],['tables'],"['furniture', 'tables', 'global', 'adaptabilities', 'conference', 'tables']",furniture tables global adaptabilities conference tables
TEC-AC-10001013,Technology,Accessories,Logitech ClearChat Comfort/USB Headset H390,"['logitech', 'clearchat', 'comfort', 'usb', 'headset', 'h390']",['technology'],['accessories'],"['technology', 'accessories', 'logitech', 'clearchat', 'comfort', 'usb', 'headset', 'h390']",technology accessories logitech clearchat comfort usb headset h390
TEC-AC-10000358,Technology,Accessories,Imation Secure Drive + Hardware Encrypted USB flash drive - 16 GB,"['imation', 'secure', 'drive', 'hardware', 'encrypted', 'usb', 'flash', '16', 'gb']",['technology'],['accessories'],"['technology', 'accessories', 'imation', 'secure', 'drive', 'hardware', 'encrypted', 'usb', 'flash', '16', 'gb']",technology accessories imation secure drive hardware encrypted usb flash 16 gb
TEC-MA-10000010,Technology,Machines,Hewlett-Packard Deskjet 3050a All-in-One Color Inkjet Printer,"['hewlett', 'packard', 'deskjet', '3050a', 'one', 'color', 'inkjet', 'printer']",['technology'],['machines'],"['technology', 'machines', 'hewlett', 'packard', 'deskjet', '3050a', 'one', 'color', 'inkjet', 'printer']",technology machines hewlett packard deskjet 3050a one color inkjet printer
OFF-AP-10002118,Office Supplies,Appliances,"1.7 Cubic Foot Compact ""Cube"" Office Refrigerators","['1', '7', 'cubic', 'foot', 'compact', 'cube', 'office', 'refrigerators']",['officesupplies'],['appliances'],"['officesupplies', 'appliances', '1', '7', 'cubic', 'foot', 'compact', 'cube', 'office', 'refrigerators']",officesupplies appliances 1 7 cubic foot compact cube office refrigerators
OFF-SU-10000157,Office Supplies,Supplies,Compact Automatic Electric Letter Opener,"['compact', 'automatic', 'electric', 'letter', 'opener']",['officesupplies'],['supplies'],"['officesupplies', 'supplies', 'compact', 'automatic', 'electric', 'letter', 'opener']",officesupplies supplies compact automatic electric letter opener
TEC-AC-10004227,Technology,Accessories,SanDisk Ultra 16 GB MicroSDHC Class 10 Memory Card,"['sandisk', 'ultra', '16', 'gb', 'microsdhc', 'class', '10', 'memory', 'card']",['technology'],['accessories'],"['technology', 'accessories', 'sandisk', 'ultra', '16', 'gb', 'microsdhc', 'class', '10', 'memory', 'card']",technology accessories sandisk ultra 16 gb microsdhc class 10 memory card
OFF-AR-10003759,Office Supplies,Art,"Crayola Anti Dust Chalk, 12/Pack","['crayola', 'anti', 'dust', 'chalk', '12', 'pack']",['officesupplies'],['art'],"['officesupplies', 'art', 'crayola', 'anti', 'dust', 'chalk', '12', 'pack']",officesupplies art crayola anti dust chalk 12 pack
OFF-PA-10001837,Office Supplies,Paper,Xerox 1976,"['xerox', '1976']",['officesupplies'],['paper'],"['officesupplies', 'paper', 'xerox', '1976']",officesupplies paper xerox 1976
TEC-PH-10001760,Technology,Phones,Bose SoundLink Bluetooth Speaker,"['bose', 'soundlink', 'bluetooth', 'speaker']",['technology'],['phones'],"['technology', 'phones', 'bose', 'soundlink', 'bluetooth', 'speaker']",technology phones bose soundlink bluetooth speaker
OFF-EN-10004846,Office Supplies,Envelopes,Letter or Legal Size Expandable Poly String Tie Envelopes,"['letter', 'legal', 'size', 'expandable', 'poly', 'string', 'tie', 'envelopes']",['officesupplies'],['envelopes'],"['officesupplies', 'envelopes', 'letter', 'legal', 'size', 'expandable', 'poly', 'string', 'tie', 'envelopes']",officesupplies envelopes letter legal size expandable poly string tie envelopes
OFF-SU-10003567,Office Supplies,Supplies,Stiletto Hand Letter Openers,"['stiletto', 'hand', 'letter', 'openers']",['officesupplies'],['supplies'],"['officesupplies', 'supplies', 'stiletto', 'hand', 'letter', 'openers']",officesupplies supplies stiletto hand letter openers
TEC-PH-10002262,Technology,Phones,LG Electronics Tone+ HBS-730 Bluetooth Headset,"['lg', 'electronics', 'tone', 'hbs', '730', 'bluetooth', 'headset']",['technology'],['phones'],"['technology', 'phones', 'lg', 'electronics', 'tone', 'hbs', '730', 'bluetooth', 'headset']",technology phones lg electronics tone hbs 730 bluetooth headset
TEC-MA-10003183,Technology,Machines,DYMO CardScan Personal V9 Business Card Scanner,"['dymo', 'cardscan', 'personal', 'v9', 'business', 'card', 'scanner']",['technology'],['machines'],"['technology', 'machines', 'dymo', 'cardscan', 'personal', 'v9', 'business', 'card', 'scanner']",technology machines dymo cardscan personal v9 business card scanner
TEC-PH-10002563,Technology,Phones,Adtran 1202752G1,"['adtran', '1202752g1']",['technology'],['phones'],"['technology', 'phones', 'adtran', '1202752g1']",technology phones adtran 1202752g1
FUR-FU-10003464,Furniture,Furnishings,"Seth Thomas 8 1/2"" Cubicle Clock","['seth', 'thomas', '8', '1', '2', 'cubicle', 'clock']",['furniture'],['furnishings'],"['furniture', 'furnishings', 'seth', 'thomas', '8', '1', '2', 'cubicle', 'clock']",furniture furnishings seth thomas 8 1 2 cubicle clock
OFF-AR-10000380,Office Supplies,Art,"Hunt PowerHouse Electric Pencil Sharpener, Blue","['hunt', 'powerhouse', 'electric', 'pencil', 'sharpener', 'blue']",['officesupplies'],['art'],"['officesupplies', 'art', 'hunt', 'powerhouse', 'electric', 'pencil', 'sharpener', 'blue']",officesupplies art hunt powerhouse electric pencil sharpener blue
OFF-ST-10001780,Office Supplies,Storage,Tennsco 16-Compartment Lockers with Coat Rack,"['tennsco', '16', 'compartment', 'lockers', 'coat', 'rack']",['officesupplies'],['storage'],"['officesupplies', 'storage', 'tennsco', '16', 'compartment', 'lockers', 'coat', 'rack']",officesupplies storage tennsco 16 compartment lockers coat rack
OFF-ST-10000918,Office Supplies,Storage,Crate-A-Files,"['crate', 'files']",['officesupplies'],['storage'],"['officesupplies', 'storage', 'crate', 'files']",officesupplies storage crate files
OFF-BI-10001196,Office Supplies,Binders,"Avery Flip-Chart Easel Binder, Black","['avery', 'flip', 'chart', 'easel', 'binder', 'black']",['officesupplies'],['binders'],"['officesupplies', 'binders', 'avery', 'flip', 'chart', 'easel', 'binder', 'black']",officesupplies binders avery flip chart easel binder black
